{
  "_comment": "Keyword lexicon behind the 'describe your problem' box. Plain word matching, no AI. A stem matches a whole word plus plain suffixes (s, es, ed, d, ing, er, ers); a trailing ~ makes it a prefix match; spaces match phrases. Add words freely; the validator checks the shape.",
  "stop_words": [
    "a",
    "an",
    "the",
    "my",
    "our",
    "your",
    "i",
    "we",
    "me",
    "to",
    "of",
    "for",
    "in",
    "on",
    "at",
    "by",
    "with",
    "from",
    "into",
    "and",
    "or",
    "then",
    "that",
    "this",
    "these",
    "those",
    "it",
    "them",
    "is",
    "are",
    "be",
    "can",
    "could",
    "should",
    "would",
    "want",
    "need",
    "like",
    "how",
    "do",
    "does",
    "so",
    "as",
    "all",
    "any",
    "some",
    "using",
    "use",
    "app",
    "tool",
    "automatically",
    "automatic",
    "please",
    "help",
    "make",
    "get",
    "have",
    "has",
    "what",
    "which",
    "when",
    "where",
    "who",
    "over",
    "about",
    "up"
  ],
  "modalities": {
    "image": [
      "photo",
      "image",
      "picture",
      "pic",
      "screenshot",
      "scan",
      "jpeg",
      "jpg",
      "png",
      "drawing",
      "diagram",
      "receipt",
      "x-ray",
      "xray",
      "satellite",
      "thumbnail",
      "selfie",
      "poster"
    ],
    "text": [
      "document",
      "doc",
      "pdf",
      "text",
      "email",
      "review",
      "article",
      "paragraph",
      "sentence",
      "message",
      "tweet",
      "post",
      "comment",
      "note",
      "transcript",
      "contract",
      "report",
      "book",
      "essay",
      "ticket",
      "file",
      "webpage",
      "web page",
      "website",
      "log",
      "chat",
      "faq",
      "resume",
      "cv",
      "knowledge base"
    ],
    "audio": [
      "audio",
      "speech",
      "voice",
      "recording",
      "podcast",
      "call",
      "meeting",
      "music",
      "song",
      "sound",
      "interview",
      "lecture",
      "voicemail",
      "phone call"
    ],
    "video": [
      "video",
      "footage",
      "clip",
      "movie",
      "stream",
      "camera feed",
      "cctv",
      "webcam",
      "security camera",
      "dashcam",
      "livestream"
    ]
  },
  "actions": [
    {
      "id": "rag",
      "priority": 4,
      "stems": [
        "chat with",
        "chat over",
        "chat about",
        "chat to",
        "talk to",
        "talk with",
        "ask questions about",
        "ask questions of",
        "question answering over",
        "qa over",
        "q&a over",
        "answer questions from",
        "answer questions about",
        "rag",
        "knowledge base"
      ],
      "steps": [
        {
          "in": "text",
          "out": "embedding",
          "label": "Embed the documents and the question"
        },
        {
          "in": "text",
          "out": "text",
          "label": "Answer from the retrieved passages"
        }
      ],
      "suppress": [
        "answer",
        "similar"
      ]
    },
    {
      "id": "diarize",
      "priority": 3,
      "stems": [
        "diariz~",
        "who spoke",
        "who is speaking",
        "who's speaking",
        "who said",
        "tag speakers",
        "label speakers",
        "identify speakers",
        "separate speakers",
        "speaker labels",
        "speakers"
      ],
      "in": "audio",
      "out": "label",
      "label": "Work out who speaks when"
    },
    {
      "id": "transcribe",
      "priority": 3,
      "stems": [
        "transcrib~",
        "transcription",
        "speech to text",
        "voice to text",
        "audio to text",
        "dictat~",
        "closed caption",
        "caption the audio"
      ],
      "in": "audio",
      "out": "text",
      "label": "Transcribe the speech"
    },
    {
      "id": "speak",
      "priority": 3,
      "stems": [
        "text to speech",
        "tts",
        "read aloud",
        "read out loud",
        "aloud",
        "read out",
        "narrat~",
        "voice over",
        "voiceover",
        "clone voice",
        "voice clon~",
        "speak",
        "synthesi~ speech",
        "audiobook",
        "my own voice",
        "sounds like me",
        "sound like me",
        "text to voice",
        "dubbing",
        "dub"
      ],
      "in": "text",
      "out": "audio",
      "label": "Turn the text into speech",
      "suppress": [
        "answer",
        "classify"
      ]
    },
    {
      "id": "gen_audio",
      "priority": 3,
      "stems": [
        "generat~",
        "creat~",
        "compos~",
        "make",
        "produc~"
      ],
      "with": [
        "music",
        "song",
        "sound effect",
        "soundtrack",
        "jingle"
      ],
      "in": "text",
      "out": "audio",
      "label": "Generate audio",
      "suppress": [
        "answer",
        "classify"
      ]
    },
    {
      "id": "gen_video",
      "priority": 3,
      "stems": [
        "generat~",
        "creat~",
        "make",
        "animat~",
        "produc~"
      ],
      "with": [
        "video",
        "clip",
        "animation",
        "movie",
        "film",
        "footage",
        "cinematic",
        "trailer"
      ],
      "in": "text",
      "out": "video",
      "label": "Generate video",
      "suppress": [
        "answer",
        "classify"
      ]
    },
    {
      "id": "edit_image",
      "priority": 3,
      "stems": [
        "edit",
        "retouch",
        "restyle",
        "upscal~",
        "inpaint~",
        "touch up",
        "enhance",
        "colorize",
        "colourise",
        "change the background",
        "restore"
      ],
      "with": [
        "photo",
        "image",
        "picture",
        "portrait",
        "selfie"
      ],
      "in": "image",
      "out": "image",
      "label": "Edit the image",
      "suppress": [
        "answer",
        "classify"
      ]
    },
    {
      "id": "gen_image",
      "priority": 3,
      "stems": [
        "generat~",
        "creat~",
        "draw",
        "design",
        "render",
        "illustrat~",
        "paint",
        "make",
        "produc~",
        "text to image"
      ],
      "with": [
        "image",
        "picture",
        "logo",
        "illustration",
        "artwork",
        "art",
        "poster",
        "icon",
        "avatar",
        "wallpaper",
        "mockup",
        "cover"
      ],
      "in": "text",
      "out": "image",
      "label": "Generate images",
      "suppress": [
        "answer",
        "classify"
      ]
    },
    {
      "id": "ocr",
      "priority": 3,
      "stems": [
        "handwriting",
        "handwritten",
        "ocr",
        "read the text in",
        "extract text from",
        "text from images",
        "text from photos",
        "text from scans",
        "scanned",
        "digitiz~",
        "digitis~"
      ],
      "in": "image",
      "out": "text",
      "label": "Read the text in the image",
      "suppress": [
        "classify",
        "answer",
        "similar"
      ]
    },
    {
      "id": "locate",
      "priority": 2,
      "stems": [
        "count",
        "locate",
        "how many",
        "bounding box",
        "segment~",
        "cut out",
        "cutout",
        "outline",
        "find all",
        "detect",
        "detection",
        "track",
        "where is",
        "background removal",
        "remove the background",
        "crop",
        "mask",
        "pick out",
        "spot",
        "find the"
      ],
      "allowed_in": [
        "image",
        "video"
      ],
      "default_in": "image",
      "out": "boxes_masks",
      "label": "Find and outline objects in the {in}"
    },
    {
      "id": "classify",
      "priority": 2,
      "stems": [
        "classif~",
        "categor~",
        "sort",
        "tag",
        "tagging",
        "label",
        "sentiment",
        "spam",
        "fraud",
        "moderat~",
        "triage",
        "route",
        "flag",
        "which category",
        "recogni~",
        "identify",
        "filter",
        "rate",
        "grade",
        "score",
        "positive or negative",
        "toxic~",
        "offensive",
        "hate speech",
        "urgent",
        "urgency",
        "priority",
        "is this",
        "whether"
      ],
      "default_in": "text",
      "out": "label",
      "label": "Classify the {in}"
    },
    {
      "id": "similar",
      "priority": 2,
      "stems": [
        "similar",
        "look like",
        "looks like",
        "lookalike",
        "search",
        "retriev~",
        "recommend~",
        "cluster~",
        "dedup~",
        "duplicate",
        "near duplicate",
        "nearest",
        "semantic",
        "embedding",
        "match",
        "related",
        "find more like",
        "compare",
        "find"
      ],
      "default_in": "text",
      "out": "embedding",
      "label": "Embed the {in} and compare"
    },
    {
      "id": "answer",
      "priority": 1,
      "stems": [
        "answer",
        "question",
        "chatbot",
        "assistant",
        "summari~",
        "summary",
        "extract~",
        "translat~",
        "rewrit~",
        "rephras~",
        "paraphras~",
        "draft",
        "write",
        "explain",
        "describe",
        "caption",
        "read",
        "turn into",
        "convert",
        "pull out",
        "analy~",
        "proofread",
        "tell me",
        "q&a",
        "faq",
        "support bot",
        "agent",
        "code",
        "reply",
        "respond",
        "brainstorm",
        "plan",
        "notes",
        "meeting notes",
        "minutes",
        "action items",